{"$id":"https://gpu-simulator.local/schemas/sm86_c7_sol_l1p080_smoke_v1.schema.json","$schema":"https://json-schema.org/draft/2020-12/schema","additionalProperties":false,"properties":{"schema":{"const":"sm86_c7_sol_l1p080_smoke_v1"},"phase":{"const":"C7-S34BE2"},"status":{"type":"string"},"candidate":{"type":"string"},"identity":{"type":"object","additionalProperties":true},"build":{"type":"object","additionalProperties":true},"correctness":{"type":"object","additionalProperties":true},"sanitizer":{"type":"object","additionalProperties":true}},"required":["schema","phase","status","candidate","identity","build","correctness","sanitizer"],"title":"SM86 C7-S34BE2 L1 problem080 build smoke","type":"object"}
