{
  "build": {
    "build_dir": "results/alpha/c7_s34be_sol_l1p080_20261005/pinned/build",
    "compiler": "/usr/bin/g++-14",
    "cuda_arch": "sm_86",
    "status": "passed",
    "stderr": "results/alpha/c7_s34be_sol_l1p080_20261005/pinned/build_correctness.stderr",
    "stdout": "results/alpha/c7_s34be_sol_l1p080_20261005/pinned/build_correctness.stdout"
  },
  "candidate": "L1/problem_080_adaptive_layernorm_continuous_with_modulation/cuda_cpp",
  "correctness": {
    "declared_workload_shapes": [
      [
        4,
        449
      ],
      [
        2,
        2048
      ],
      [
        1,
        4096
      ],
      [
        1,
        256
      ],
      [
        1,
        1024
      ],
      [
        4,
        256
      ],
      [
        1,
        128
      ],
      [
        2,
        128
      ],
      [
        16,
        256
      ],
      [
        2,
        1321
      ],
      [
        2,
        293
      ],
      [
        1,
        2048
      ],
      [
        1,
        997
      ],
      [
        8,
        1024
      ],
      [
        2,
        512
      ],
      [
        32,
        128
      ]
    ],
    "oracle": "independent definition reference.py FP32 adaptive LayerNorm/modulation",
    "rows": [
      {
        "batch": 4,
        "elements_exceeding_declared_tolerance": 0,
        "finite": true,
        "max_abs_error": 0.00030517578125,
        "mean_abs_error": 1.8837363313650712e-05,
        "passed": true,
        "seed": 223,
        "seq_len": 449,
        "workload_index": 0
      },
      {
        "batch": 2,
        "elements_exceeding_declared_tolerance": 0,
        "finite": true,
        "max_abs_error": 0.00030517578125,
        "mean_abs_error": 1.8668884877115488e-05,
        "passed": true,
        "seed": 223,
        "seq_len": 2048,
        "workload_index": 1
      },
      {
        "batch": 1,
        "elements_exceeding_declared_tolerance": 0,
        "finite": true,
        "max_abs_error": 0.000213623046875,
        "mean_abs_error": 1.374780731566716e-05,
        "passed": true,
        "seed": 223,
        "seq_len": 4096,
        "workload_index": 2
      },
      {
        "batch": 1,
        "elements_exceeding_declared_tolerance": 0,
        "finite": true,
        "max_abs_error": 0.00018310546875,
        "mean_abs_error": 1.3666778613696806e-05,
        "passed": true,
        "seed": 223,
        "seq_len": 256,
        "workload_index": 3
      },
      {
        "batch": 1,
        "elements_exceeding_declared_tolerance": 0,
        "finite": true,
        "max_abs_error": 0.000213623046875,
        "mean_abs_error": 1.4880049093335401e-05,
        "passed": true,
        "seed": 223,
        "seq_len": 1024,
        "workload_index": 4
      },
      {
        "batch": 4,
        "elements_exceeding_declared_tolerance": 0,
        "finite": true,
        "max_abs_error": 0.00030517578125,
        "mean_abs_error": 1.9111219444312155e-05,
        "passed": true,
        "seed": 223,
        "seq_len": 256,
        "workload_index": 5
      },
      {
        "batch": 1,
        "elements_exceeding_declared_tolerance": 0,
        "finite": true,
        "max_abs_error": 0.00016021728515625,
        "mean_abs_error": 1.3650603250425775e-05,
        "passed": true,
        "seed": 223,
        "seq_len": 128,
        "workload_index": 6
      },
      {
        "batch": 2,
        "elements_exceeding_declared_tolerance": 0,
        "finite": true,
        "max_abs_error": 0.000244140625,
        "mean_abs_error": 1.8486325643607415e-05,
        "passed": true,
        "seed": 223,
        "seq_len": 128,
        "workload_index": 7
      },
      {
        "batch": 16,
        "elements_exceeding_declared_tolerance": 0,
        "finite": true,
        "max_abs_error": 0.000244140625,
        "mean_abs_error": 1.4793884474784136e-05,
        "passed": true,
        "seed": 223,
        "seq_len": 256,
        "workload_index": 8
      },
      {
        "batch": 2,
        "elements_exceeding_declared_tolerance": 0,
        "finite": true,
        "max_abs_error": 0.00030517578125,
        "mean_abs_error": 1.92994066310348e-05,
        "passed": true,
        "seed": 223,
        "seq_len": 1321,
        "workload_index": 9
      },
      {
        "batch": 2,
        "elements_exceeding_declared_tolerance": 0,
        "finite": true,
        "max_abs_error": 0.000274658203125,
        "mean_abs_error": 1.8968476069858298e-05,
        "passed": true,
        "seed": 223,
        "seq_len": 293,
        "workload_index": 10
      },
      {
        "batch": 1,
        "elements_exceeding_declared_tolerance": 0,
        "finite": true,
        "max_abs_error": 0.000213623046875,
        "mean_abs_error": 1.3758060958934948e-05,
        "passed": true,
        "seed": 223,
        "seq_len": 2048,
        "workload_index": 11
      },
      {
        "batch": 1,
        "elements_exceeding_declared_tolerance": 0,
        "finite": true,
        "max_abs_error": 0.000213623046875,
        "mean_abs_error": 1.4881414244882762e-05,
        "passed": true,
        "seed": 223,
        "seq_len": 997,
        "workload_index": 12
      },
      {
        "batch": 8,
        "elements_exceeding_declared_tolerance": 0,
        "finite": true,
        "max_abs_error": 0.000244140625,
        "mean_abs_error": 1.4754858966625761e-05,
        "passed": true,
        "seed": 223,
        "seq_len": 1024,
        "workload_index": 13
      },
      {
        "batch": 2,
        "elements_exceeding_declared_tolerance": 0,
        "finite": true,
        "max_abs_error": 0.00031280517578125,
        "mean_abs_error": 1.9355638869456016e-05,
        "passed": true,
        "seed": 223,
        "seq_len": 512,
        "workload_index": 14
      },
      {
        "batch": 32,
        "elements_exceeding_declared_tolerance": 0,
        "finite": true,
        "max_abs_error": 0.00030517578125,
        "mean_abs_error": 1.8789512978401035e-05,
        "passed": true,
        "seed": 223,
        "seq_len": 128,
        "workload_index": 15
      },
      {
        "batch": 4,
        "elements_exceeding_declared_tolerance": 0,
        "finite": true,
        "max_abs_error": 0.000335693359375,
        "mean_abs_error": 1.8543783880886622e-05,
        "passed": true,
        "seed": 224,
        "seq_len": 449,
        "workload_index": 0
      },
      {
        "batch": 2,
        "elements_exceeding_declared_tolerance": 0,
        "finite": true,
        "max_abs_error": 0.0003662109375,
        "mean_abs_error": 1.899370181490667e-05,
        "passed": true,
        "seed": 224,
        "seq_len": 2048,
        "workload_index": 1
      },
      {
        "batch": 1,
        "elements_exceeding_declared_tolerance": 0,
        "finite": true,
        "max_abs_error": 0.000244140625,
        "mean_abs_error": 1.4161541002977174e-05,
        "passed": true,
        "seed": 224,
        "seq_len": 4096,
        "workload_index": 2
      },
      {
        "batch": 1,
        "elements_exceeding_declared_tolerance": 0,
        "finite": true,
        "max_abs_error": 0.00018310546875,
        "mean_abs_error": 1.3739259884459898e-05,
        "passed": true,
        "seed": 224,
        "seq_len": 256,
        "workload_index": 3
      },
      {
        "batch": 1,
        "elements_exceeding_declared_tolerance": 0,
        "finite": true,
        "max_abs_error": 0.000244140625,
        "mean_abs_error": 1.4212071619112976e-05,
        "passed": true,
        "seed": 224,
        "seq_len": 1024,
        "workload_index": 4
      },
      {
        "batch": 4,
        "elements_exceeding_declared_tolerance": 0,
        "finite": true,
        "max_abs_error": 0.00030517578125,
        "mean_abs_error": 1.885573146864772e-05,
        "passed": true,
        "seed": 224,
        "seq_len": 256,
        "workload_index": 5
      },
      {
        "batch": 1,
        "elements_exceeding_declared_tolerance": 0,
        "finite": true,
        "max_abs_error": 0.00016021728515625,
        "mean_abs_error": 1.4372323676070664e-05,
        "passed": true,
        "seed": 224,
        "seq_len": 128,
        "workload_index": 6
      },
      {
        "batch": 2,
        "elements_exceeding_declared_tolerance": 0,
        "finite": true,
        "max_abs_error": 0.000244140625,
        "mean_abs_error": 1.8689224816625938e-05,
        "passed": true,
        "seed": 224,
        "seq_len": 128,
        "workload_index": 7
      },
      {
        "batch": 16,
        "elements_exceeding_declared_tolerance": 0,
        "finite": true,
        "max_abs_error": 0.00030517578125,
        "mean_abs_error": 1.4980853848101106e-05,
        "passed": true,
        "seed": 224,
        "seq_len": 256,
        "workload_index": 8
      },
      {
        "batch": 2,
        "elements_exceeding_declared_tolerance": 0,
        "finite": true,
        "max_abs_error": 0.000293731689453125,
        "mean_abs_error": 1.8921618902822956e-05,
        "passed": true,
        "seed": 224,
        "seq_len": 1321,
        "workload_index": 9
      },
      {
        "batch": 2,
        "elements_exceeding_declared_tolerance": 0,
        "finite": true,
        "max_abs_error": 0.000335693359375,
        "mean_abs_error": 1.9216278815292753e-05,
        "passed": true,
        "seed": 224,
        "seq_len": 293,
        "workload_index": 10
      },
      {
        "batch": 1,
        "elements_exceeding_declared_tolerance": 0,
        "finite": true,
        "max_abs_error": 0.000213623046875,
        "mean_abs_error": 1.3688372746401e-05,
        "passed": true,
        "seed": 224,
        "seq_len": 2048,
        "workload_index": 11
      },
      {
        "batch": 1,
        "elements_exceeding_declared_tolerance": 0,
        "finite": true,
        "max_abs_error": 0.000244140625,
        "mean_abs_error": 1.421274555468699e-05,
        "passed": true,